<?xml version="1.0"?>
<!-- Имя файла: students.xml -->

<!DOCTYPE students[
	<!ELEMENT students (student+)>
	<!ELEMENT student (lastName, firstName, middleName, birthDate, adres, progress)>
	<!ELEMENT lastName (#PCDATA)>
	<!ELEMENT firstName (#PCDATA)>
	<!ELEMENT middleName (#PCDATA)>
	<!ELEMENT birthDate (#PCDATA)>
	<!ELEMENT adres (#PCDATA)>
	<!ELEMENT progress (#PCDATA)>
]>

<students>

	<student>
		<lastName>&lt;i>Королюк&lt;/i></lastName>
		<firstName>&lt;i>Юрий&lt;/i></firstName>
		<middleName>&lt;i>Иванович&lt;/i></middleName>
		<birthDate>15.05.1993</birthDate>
		<adres>
			<![CDATA[
				<Республика Беларусь>
			]]>
		</adres>
		<progress>imgs/1.jpg</progress>
	</student>

	<student>
		<lastName>&lt;i>Титова&lt;/i></lastName>
		<firstName>&lt;i>Александра&lt;/i></firstName>
		<middleName>&lt;i>Богдановна&lt;/i></middleName>
		<birthDate>07.11.1989</birthDate>
		<adres>
			<![CDATA[
				<г. Заокский, ул. Дарвина, дом 34, квартира 30>
			]]>
		</adres>
		<progress>imgs/2.jpg</progress>
	</student>
	<!-- знак < (меньше) &lt; &#60; -->
	<student>
		<lastName>&lt;i>Кириллов&lt;/i></lastName>
		<firstName>&lt;i>Стоян&lt;/i></firstName>
		<middleName>&lt;i>Романович&lt;/i></middleName>
		<birthDate>08.05.1986</birthDate>
		<adres>&lt;г. Усть-Абакан, ул. Сержанта Елизарова, дом 22, квартира 286></adres>
		<progress>imgs/3.jpg</progress>
	</student>

	<student>
		<lastName>&lt;i>Чистякова&lt;/i></lastName>
		<firstName>&lt;i>Эвелина&lt;/i></firstName>
		<middleName>&lt;i>Даниловна&lt;/i></middleName>
		<birthDate>03.06.1994</birthDate>
		<adres>&#60;г. Лотошино, ул. Садовая, дом 12, квартира 222></adres>
		<progress>imgs/4.jpg</progress>
	</student>

</students>